context,key
느끼다 고기 손수,0
맛있다 소주 분들 맛있다 예쁘다 나중 맛있다 굽다 편하다 시원하다 맛있다 모습 맛있다 고기 맛있다 불편하다 맛있다 진짜 부드럽다,1
맛있다 탐라 탕 맛있다 파채 안 맛있다 웨이 팅 맛있다 고기 먹다 맛있다 금새 바닥나다 맛있다 계속 굽다 맛있다 토마 토도 맛있다 탐라 담 맛있다 고기 메다 맛있다 오늘 기 맛있다 걸 생생하다 맛있다 조만간 또 맛있다 굽다 있다 맛있다 말로 표현 맛있다 하다 고 고기 맛있다 다 맛있다 정말 맛있다 정말 맛있다 질 맛있다 너무 맛있다 너무 맛있다 랑 맛있다 고기 맛있다 진짜 맛있다 정말 맛있다 어느덧다 맛있다 요 맛있다 정말 맛있다 초밥 맛있다 너무 맛있다 모두 맛있다,1
맛있다 먹다 수 맛있다 제 주산 맛있다 먹다 보고 맛있다 배곧 맛집 맛 있다 대한 맛 있다 가득 맛 있다 보이 맛 있다 굽다 맛 있다 의 후 맛있다 알다 맛있다 더 맛있다 하다 맛있다 고소하다 맛 이다 싱싱하다 오다 제공,1
맛집 빛나다 탐라 맛집 이르다 소문나다 맛보다 수 있다 맛있다 먹다 좋아하다 맛집 찾다 좋다 부드럽다 맛있다 너무 맛있다 훨씬 부드럽다 신선 신선 불판 싱싱하다 쌈 해주다,1
맛있다 두 번 정말 맛있다 정말 맛있다 백억천 맛있다 너무 맛있다,1
맛있다 고기 굽다 맛있다 열심히 사진 고기 맛있다 완전 맛있다 너무 맛있다 요 맛있다,1
맛있다 탐라 담 맛있다 제주 생 맛있다 제주 삼겹살 너무 맛있다 정말 맛있다 너무 맛있다 완전 맛있다,1
맛있다 고민 하다 맛있다 식당 있다 맛집 에서 맛있다 너무 맛있다 너무 맛있다 에서 맛있다 고소하다 담백하다 요 부드럽다 고소하다 부드럽다 고소하다 담백하다 진짜 싱싱하다,1
맛있다 후식 먹다 맛있다 우유 많다 맛있다 자다 먹다 어울리다 맛있다 고소하다 맛있다 랑 맛있다 녹다 맛있다 고소하다 맛있다 후식 굉장하다 고소하다,1
맛집 수 있다 맛있닼 생 갈비 맛보다 수 있다 맛있다 친절하다 안심 거 맛있닼,1
맛있다 하다 식사 맛있다 취향 맞다 먹다 맛있다 다 맛있다 싱싱하다 전복 과 하하 싱싱하다,1
맛있다 기본 상차림 맛있다 익다 소중하다 맛있다 알다 흑 맛있다 꽈리 고추 맛있다 먹다 되다 맛있다 체인점 이다 로서 맛있다 먹다 맛있다 어느덧다 맛있다 분 맛있다 보다 맛있다 자다 맛있다 규 맛있다,1
맛있다 요 하다 맛있다 들다 보다 맛 그냥 맛있다 로 맛있다 그냥 맛있다 정말 맛있다 고소하다 로 늘리다 고소하다 에서 수 고소하다 맛 이르다 담백하다 고소하다 이렇다 고소하다,1
간이 강하다 않다 맛있다 파이 아삭아삭 더 맛있다 국물 맛있다 고추 맛있다 너무 맛있다 고소하다 남녀 누가 주문 고소하다 신선하다 보이다 다 신선하다 강하다 질 차암 신선하다 무치다 신선하다,1
맛있다 밑반찬 궁합 다 맛있다 하다 신선하다 촉촉 고기 하다,1
정말 맛있다 고소 얼 그냥 싱싱하다 때 먹다 싱싱하다 딱 오다 싱싱하다 고기 맛 만들다 싱싱하다 메뉴 싱싱하다 초밥 싱싱하다,1
간 맞추다 방문 맛있다 추천 당연하다 평이 맛있다 물론 맛있다 고소하다 달아오르다 불판 고소하다 담백하다 느끼다 느껴지다 고소하다 의 고소하다,1
맛있다 판이 달구다 맛있다 배곧 고기 있다 맛집 더욱 맛있다 보고서 맛있다 너무나 맛있다 정갈하다 차리다 요드 각종 정갈하다,1
맛보다 수 있다 고소하다 제주 생 고소하다 담백하다 부드러움 비교 고소하다 의 고소하다 싱싱하다 생 갈비 다 싱싱하다,1
맛있다 메다 젓 데리야끼 맛있다 더 맛있다 엄청 고소하다 신선하다 기상 추도 쌈 신선하다,1
맛있다 해주다 고기 맛있다 된장찌개 주문 맛있다 취향 고르다 맛있다 자다 먹다 너무 맛있다 다 맛있다 너무 맛있다,1
맛있다 맛보다 번 맛있다 고기 만 맛 좋다 서비스 맛있다 맛보다 고소하다 생갈 비제 고소하다 삼겹살 고기 있다 고소하다 찬 고소하다,1
맛있다 굽다 고기 맛있다 알다 질문 맛있다 고소하다 감탄 맛있다 굽다 진짜 맛있다 꽈리 고 진짜 맛있다 중간 맛있다 워낙 맛있다 주다 맛있다 너무 맛있다 고소하다 감탄 먹기 고소하다 부드럽다 삼겹살 굽다 고소하다 맛있다 고소하다 많다 고소하다 부드럽다 삼겹살 진짜 고소하다 부드럽다 신선하다 여서 탐라 두껍다 신선하다 정갈하다 반찬 과 깔끔하다 정갈하다,1
맛있다 전수 해 맛있다 사장 님 맛있다 소금 찍다 맛있다 고기 곁들이다 맛있다 먹다 추 맛있다 나오다 일행 맛있다 밥 도둑 맛 맛있다 밥 굽다 맛있다 더 맛있다 맛 맛있다 하라 맛있다 소금 맛있다 분 맛있다 정갈하다 맛있다 맛 맛있다 신선하다 느껴지다 무치다 두다 신선도 에서 신선하다 정갈하다 맛있다 나오다 켜다 정갈하다,1
곁들이다 맛있다 싱싱하다 주산 내부 싱싱 하단 하다 방문 싱싱하다,1
맛있다 좋다 이렇게 맛있다 생 갈비 호크 맛있다 너무 맛있다 부드럽다 이상하다 꼬소해 진짜 부드럽다,1
간 맞추다 자다 간 맞추다 역시 맛있다 싱싱하다 쌈 맛있다 자다 되다 맛있다 하다 여기 맛있다 하다 하다 맛있다 요 지방 맛있다 새삼 부드럽다 맛있다 조합 알다 맛있다 하다 바로 맛있다 생갈 비다 맛있다 저희 원래 맛있다 하다 저희 맛있다 주다 너무 맛 너무 맛있다 나오다 맛있다 찍다 맛있다 먹다 맛있다 너무 맛있다 너무 맛있다 께서 맛있다 먹다 맛있다 제일 맛있다 생갈 맛있다 너무 맛있다 너무 맛있다 제일 맛있다 제일 맛있다 고소하다 조합 너무 의 고소하다 부드럽다 느끼다 지다 새삼 부드럽다 싱싱하다 쌈 채소 맛있다 싱싱하다,1
툼 맛있다,1
간이 아주 딱 속 촉촉하다 정갈하다 깔끔하다 나오다 등등 정갈하다,1
맛있다 거 먹다 맛보다 수 있다 맛있다 진짜 고기 맛있다 하다 배곧 맛집 소문나다 이유 맛 너무 맛있다 오늘 맛있다 너무 맛있다 고기 맛있다 하다 맛있다,1
간이 세지 않다 맛보다 수 있다 맛 덜하다 좋다 맛 나다 굽다 맛 맛깔 나다 맛 나다 즐기다 좋다 맛있다 고소하다 가득하다 입가심 부드럽다 청 포묵 신선하다 딱 새우 신선하다 식다 료 나오다 신선도,1
맛있다 퍽퍽 하다 너무 맛있다 고소하다 육즙 팍팍 맛 고소하다 함께 고소하다 부드럽다 제주 까지 너무 부드럽다,1
맛있다 하짘탐라담 하다 맛있다 서비스 이렇다 맛있다 거 먹다 맛 있다 식사 그냥 맛있다 그냥 맛있다 가보다 맛있다 고소하다 우리나라 고기 고소하다 돈 마 의 고소하다 의 고소하다,1
맛있다 배곧 맛집 고기 맛있다 신선하다 맛있다 부드럽다 육즙 아주 고기 부드럽다,1
맛있다 배곧 맛집 맛있다 보다 바로 고기 맛있다 빨리 맛있다 고소하다 오다 생 쫀득 고소하다,1
맛보다 수 좋다 맛있다 탐라 담 굽다 맛있다 고소하다 달리다 배곧 게요 고소하다,1
맛있다 오다 꼬솝 맛있다 생 갈비 올리다 맛있다 더욱 맛있다,1
맛보다 수 있다 맛있다 거 무더위 더 맛있다 부드럽다 꽈리 고 진짜 부드럽다,1
맛있다 전복 들다 맛있다 먹다 좋다 맛있다 상큼 고기 맛있다 찌개 맛있다 담다 맛있다 요 맛있다 굽다 맛있다 오다 맛있다 더 맛있다 더 맛있다 스럽다 맛있다 탕 맛있다 찌개 맛있다 더 맛있다 부드럽다 숙성 자다 굽다 부드럽다 정갈하다 회식 하다 끄다 정갈하다,1
간이 딱 맞다 맛있다 깃밥 냉면 싸다 맛있다 다 맛있다 고소하다 고기 냄새 고소하다 맛 가미 고소하다 양념 더하다 섞이다 고소하다 오다 고소하다 부드럽다 오다 고소하다 신선하다 부드럽다 신선하다 부드럽다 오다 맞다 신선하다 차다 정갈하다,1
맛있다 삼겹살 이에요 맛있다 고기 소주 진짜 맛있다 요 맛있다 싶다 맛있다 고소하다 입 안 느끼하다 고소하다,1
맛있다 당연하다 거 맛있다 다르다 에서 고기 맛있다 기존 맛있다 싱싱하다 맛있다 하다 싱싱하다 고기 싱싱하다,1
맛 있다 사진 기다리다 맛있다 더 맛있다 정갈하다 비우다 요정,1
맛 좋다 술,1
맛있다 파절 오다 오다 맛있다 먹다 맛있다 부드럽다 식감 과 상차림 정갈하다,1
맛있다 추천 서핑 친절하다 맛있다,1
맛있다 익다 삼겹살 맛있다 들다 있다 맛있다 배곧 점심 노릇 맛있다 분 맛있다 너무 맛있다 너무 부드럽다 신선하다 보이 살코기 빛깔 신선하다,1
맛있다 고기 나오다 맛있다 더라고요 여쭈다 담백하다 맛있다 정말 맛있다 고소하다 담백하다 맛있다 부드럽다 고소하다 부드럽다 고소하다 담백하다 알다 부드럽다,1
너무 맛있다,1
맛있다 알콜 맛 더욱 맛있다 고소하다 일품 아쉽다 더하다 고소하다 촉촉하다 맺다 돌다 어찌나 촉촉하다,1
맛있다 제 맛 맛있다 말 많이 맛있다 꽈리 고추 맛보다 정말 좋다 보다 맛있다 저 맛있다 고소하다 맛 수시로 고소하다 꽈리 고추 씹다 고소하다 의 고소하다,1
부드럽다 육즙 풍부하다 되어다 부드럽다,1
맛있다 시원하다 맛 맛있다 굽다 어렵다 맛있다 말 전 나베 맛있다 고기 맛있다 로 맛있다 거의 맛있다,1
맛있다 느끼다 처음,1
맛있다 느껴지다 고기 맛있다 서비스 많이 고기 맛있다 너무 맛있다 그냥 맛있다 고소하다 까지 잊혀지다 고소하다 잊혀지다 탐라 의 고소하다 담백하다 고소하다 신선하다 수 퀄리티 하다 신선하다,1
느끼다 배곧 맛집,0
느끼다 볼 있다 느끼다 밉다 제대로 느끼다 수 가지 느끼다 싶다 무덥다,0
맛깔나다 곱씹다 볼 차다 맛깔나다 고소하다 새다 정말 과 고소하다,1
맛있다 많다 고기 맛있다 하다 표갓 맛보다 수 있다 너무 맛있다 고기 맛있다 고소하다 그냥 고기,1
맛있다 때 싶다 너무 맛있다 칼칼하다 맛있다,1
맛있다 메다 젖 맛있다 자다 먹다 먹다 맛있다 넘다 맛있다 고용 맛있다 도락 맛있다 쫄깃하 맛있다 돼지고기 맛있다,1
느끼다 수 있다,0
맛있다 먹다 탐라 너무 맛있다 신선하다 부드럽다 신선 자체 사장 고기 신선하다,1
맛있다 일반 소금 젓 맛있다,1
맛있다 자다 먹다 맛있다 저 모르다 맛있다 먹다 정도 맛있다 자다 먹다 맛있다 솔솔 라오 맛있다 것 같다 맛있다 겠다 여기 맛있다 자다 먹다 맛있다 특히 게 맛있다 거 잖다 맛있다 매콤 하다 맛있다 자다 먹다 맛있다 편이 라 맛있다 자다 먹다 맛있다 것 물론 맛 나다 대파 맛 좋다 맛있다 많다 맛있다 라 맛있다 부드럽다 맛있다 워낙 맛있다 너무 맛있다 너무 맛있다 목살 맛있다 있다 맛있다 워낙 맛있다 정말 맛있다 듬뿍 맛있다 너무 맛있다 먹다 맛있다 좋다 맛있다 고소하다 맛있다 고기 맛있다 대비 맛있다 라 맛있다 음식 맛있다 상당하다 맛있다 고소하다 맛있다 매콤 너무 고소하다 부드럽다 육즙 많다 워낙 부드럽다 싱싱하다 대파 로 기다 싱싱하다,1
맛부 있다 파랑,1
맛 나다 먹다,1
맛있다 깻 잎 젓 맛있다 먹다 맛있다,1
맛있다 찾다 돼다 맛있다 암튼 롷 맛찬 맛있다 부안 맛있다 쫀득살 정말 자다 맛있다 올려주다 맛있다 진짜 맛있다 김치 맛있다 더 맛있다 두껍다 맛있다 틀다 맛있다,1
맛있다 분 많다 맛있다 간단하다 해주다 맛있다 쫀득 저희 맛있다 간장 밥 맛있다 쫀득 쫀득 맛 중독 있다 젓 맛있다 제일 맛있다 자르다 맛있다 넘다 맛있다 쉐낏 맛있다 세상 맛있다,1
맛있다 오랜 만 맛있다 하다 오랜 맛있다 것 같다 맛 있다 서비스 나 맛있다 너무 맛있다 더욱 맛있다 고소하다 맛 입안 고소하다 콩가루 묻히다 섞다 고소하다 껍데기 고소하다 부드럽다 식감 것 부드럽다 맛 보다는 뭔가 부드럽다 보다는 부드럽다 촉촉하다 어 떨다 때 촉촉하다 싱싱하다 채소 과 요 싱싱하다,1
진짜 맛있다 너무 맛있다,1
정갈하다 특이하다 나오다 정갈하다 담기다 나오다 상차림 정갈하다 불판 정갈하다,1
맛있다 궁금하다 쫀득살 맛있다 추천 고 맛있다 곳 배곧 많다 맛있다 저렴하다 맛있다 고기 맛있다 신선 사담 고기,1
맛있다 것 같다 맛집 있다 게 맛 나다 뒷 더 맛있다 부드럽다 씹다 것 담백하다 부드럽다 고기 부드럽다 것 부드럽다 신선하다 육즙 붙잡다 의 신선하다,1
맛있다 자다 굽다 맛있다 되다 게 빡쎘다 맛있다 껍데기 맛있다,1
맛있다 매콤 달짝지근하다 맛있다 저 쫀득살 맛있다 거 동생 너무 맛있다 진짜 맛있다 진짜 맛있다 먹다 맛있다 인 맛있다 다 맛있다,1
맛있다 부드럽다 즐기다 맛있다 고기 매콤 맛있다 자다 먹다 맛있다 먹다 수 맛 더 살아나다 고기 맛있다 너무 맛있다 더 맛있다 수 맛있다 정말 맛있다 너무 맛있다 더 맛있다 고소하다 메다 젓 고소하다 더 맛있다 고소하다 매콤 하다 소스 고소하다 먹다 고소하다 먹다 고소하다 의 고소하다 부드럽다 고기 그리고 맛있다 부드럽다 촉촉하다 느낌 받다,1
맛있다 가보다 돼다 맛있다 먹다 이다 맛있다 깻 잎 맛있다 끓다 올라서다 맛있다 고기 쌈 맛있다 기대 되다 맛있다 매콤 하다 맛있다 것 같다 맛있다 먹다 어요 맛있다 지다 여기 맛있다 도시락 적당하다 맛있다 자다 먹다 맛있다 식사 하다 맛있다 자다 먹다 맛있다 것 많다 맛있다 편이 라 맛있다 친구 이랑 맛 좋다 부담 알아보다 맛있다 어찌나 맛있다 먹다 맛있다 보글보글 맛있다 매콤 맛있다 얼마나 맛있다 먹다 맛있다 정말 맛있다 차다 맛있다 삼다 맛있다 어찌나 맛있다 도시락 맛있다 이르다 맛있다 때 맛있다 부드럽다 맛있다 하다 맛있다 워낙 맛있다 상당하다 맛있다 여기 맛있다 고소하다 쫄깃 하다 고소 하다 짤짤 자르다 고소하다 부드럽다 맛있다 자다,1
맛있다 하다 찌개 맛 훨씬 좋다 진짜 맛있다 먹다 맛있다 하다 고소하다,1
맛 좋다 친절 진짜 맛있다 진짜 맛있다,1
살인 맛있다 부드럽다 육즙 목 목살 부드럽다,1
맛 자다 살아나다 니 맛있다 부드럽다 고기 분위기 잡다 부드럽다,1
맛있다 고기 놓다 맛있다 굽다 고기 맛있다 먹다 수가 맛있다 먹다 수 맛있다 대파 김치 맛있다 줄 시흥 맛있다 수가 요 맛있다 먹다 수 맛 나다 거 날 맛있다 요 맛있다 자르다 맛있다 먹다 맛있다 같이 맛있다 비싸다 맛있다 더 맛있다 싱싱하다 가격 맞추다,1
맛있다 궁금하다 라서 맛있다 버터 오다 맛있다 고기 오다 여서 맛있다 로 맛있다 정말 맛있다 찾다 맛있다 정갈하다 밑반찬 인상 깔끔하다 정갈하다,1
김치찌개 맛있다 김치 맛있다 또 맛있다 같이 맛있다 고소하다 씹다 느낌 속 고소하다 부드럽다 와는 확실하다 식감 부드럽다,1
편하다 맛있다 육즙 맛있다,1
맛집 더욱 좋아하다 맛있다 절임 맛있다 맛있다 요한 베다 아삭거리다 맛있다 젓다 맛있다 절임 맛있다 너무 맛있다 너무 맛있다 정말 맛있다 정말 맛있다 정말 맛있다 밥 맛있다 고소하다 칼칼하다 찌개 고소하다 더욱 강렬하다 고소하다 파향 진하다 고소하다 나오다 미치다 의 고소하다 의 고소하다 보다 고소하다 의 고소하다 부드럽다 살 정말 오다 부드럽다,1
맛있다 나 목살 꼬득살 맛있다 너무 맛있다,1
맛있다 익다 하다 맛있다 직원 분 맛있다 자다 굽다 맛있다 다 익다 맛있다 먹다 수 맛있다 충실하다 맛 맛있다 취향 찍다 맛있다 고기 느끼하다 맛있다 계속 것 맛있다 것 조금 맛있다 생기다 후 맛있다 같이 오다 맛있다 육즙 목살 맛있다 사장 님 맛 정말 맛있다 굽다 맛있다 노릇 맛있다 훨씬 맛있다 너무 맛있다 더 맛있다 먹다 맛있다 정말 맛있다 정말 맛있다 하 맛있다 정말 맛있다 정말 맛있다 정말 맛있다 소한 맛있다 살 맛있다 너무 맛있다 너무 맛있다 부드럽다 익다 고기 부드럽다 촉촉하다 살짝 부드럽다 하다 번 촉촉하다 부드럽다 먹다 부드럽다 촉촉하다 부드럽다 익다 촉촉하다 살짝 더 촉촉하다 너무 맛있다 과 촉촉하다 부드럽다 촉촉하다 먹다 촉촉하다 싱싱하다 겨 굽다 고기 싱싱하다,1
맛있다 육수 완전 맛있다 맛집 나오다 있다 맛집 너무 맛있다 시키다 맛있다 고소하다 굿 여기 따뜻하다 고소하다,1
간 맞추다 면 맛있다 널리 널리 맛있다 하나 하나 맛있다 직원 분 맛있다 수 요 맛있다 굽 고 맛있다 실화 입 맛있다 숯불 삼겹살 맛있다 맛집 이다 우왕 맛있다 하나 맛있다 선하다 맛있다 너무 맛있다 이러니 맛있다 너무 맛있다 버리다 맛있다 너무 맛있다 요 맛있다 정말 맛있다 부드럽다 고기 이러니 촉촉하다 부드럽다 촉촉하다 부드럽다 고기 정갈하다 셋팅 해주다 정갈하다 셋팅해 주시 젖쌈 정갈하다 반찬 정갈하다,1
맛있다 들어가다 버리다 맛있다 먹다 고 맛있다 엔 쫀득살 보다 맛있다 로 맛있다 굉장하다 맛있다 쫀득살 맛있다 고기 맛있다 넘다 맛있다,1
고소하다 콩 고물 고소하다 하다 거 고소하다 맛 올라오다 픽 고소하다 엄마 고소하다 씹다 고소하다 싱싱하다 맛보다 좋다 특히 싱싱하다,1
맛있다 깻잎 나물 맛있다 고기 하다 것 맛있다 더 맛있다 부드럽다 비계 맛 굉장하다 부드럽다,1
맛있다 직원 분 맛있다 먹다 실망 맛있다 익다 모습 맛있다 들다 하나 너무 맛있다 너무 맛있다 숯불 맛있다 엄마 맛있다 진짜 맛있다 진짜 맛있다 시원하다 맛있다 너무 맛있다 다 맛있다 부드럽다 씹히다 자다,1
맛있다 쫀득 흔하다 맛있다 밑반찬 구성 다 맛있다 로 맛있다 목살 맛있다 고기 맛있다 정말 맛있다,1
맛있다 굽다 특히 맛있다 담백하다 이랑 맛있다 고기 맛집 죠 맛있다 넘다 맛있다 어울리다 맛있다 너무 맛있다 찬 맛있다 고소하다 맛 요 팡팡 고소하다,1
맛있다 분위기 모임 맛있다 조합 저 맛있다 굽다 맛있다 맛있다 익다 숙성 맛있다 특히 매콤 맛있다 김치찌개 좀 맛있다 먹다 고기 맛있다 수 밖에 맛있다 보이다 에서 맛있다 보 여서 맛있다 먹다 수 맛있다 다른 밑반찬 맛있다 그렇다 술 맛있다 맛 알다 맛있다 자주 고 맛있다 친구 여기다 맛 살아나다 여기 맛 좋다 특히 맛 하다 살아나다 맛 너무 좋다 돼다 맛있다 너무 맛있다 에서 맛있다 굽다 맛있다 부드럽다 맛있다 비비다 맛있다 삼겹 맛있다 좋다 맛있다 너무 맛있다 너무 맛있다 더 맛있다 차다 맛있다 고기 맛있다 메뉴 맛있다 너무 맛있다 다 맛있다 훨씬 맛있다 그렇다 맛있다 기 맛있다 슈덮밥 맛있다 보다 맛있다 고소하다 맛있다 고소하다 맛 하다 양념 고소하다 호두과자 고소하다 부드럽다 맛있다 특히 부드럽다 쫄깃 하다 부드럽다 입 넣다 고기 부드럽다 보다 부드럽다 있다 부드럽다,1
맛있다 있다 하다 맛있다 왜 이렇게 맛있다 요 고기 맛있다 또 주문 맛있다 비계 이랑 맛있다 고소 하니 맛있다 계속 가게 맛있다 기 집 맛 좋다 쫀득 맛 나다 먹다 너무 맛있다 숯 맛있다 보다 맛있다 더 맛있다 정말 맛있다 진짜 맛있다 더 맛있다 정말 맛있다 진짜 맛있다 부드럽다 맛있다 더 맛있다 하니 맛있다 에서 맛있다 고소 하니 맛있다 부드럽다 맛있다 비계 삽겹살 부드럽다,1
맛있다 것 같다 맛있다 좋아하다 남편 다 맛있다 굽다 맛있다 쫀득살 맛있다,1
가득하다 맛있다,1
맛있다 고기 올리다 맛있다 하다 맛 안타깝다 맛있다 남편 맛있다,1
고소하다 쫄깃 하다 고소하다 두 로 입히다 고소하다 콩가루 고소하다 촉촉하다 부드러움 물론 육즙 촉촉하다,1
맛있다 저 육즙 맛있다 계란 가루 맛 있다 저 너무 맛있다 요 맛있다 부드럽다 아 저 퍽퍽함 부드럽다,1
맛있다 시흥 배곧 맛있다 깜짝 놀라다 맛있다 여기 서다 맛있다 것 같다 맛있다 정말 맛 맛있다 탕수육 이랑 맛있다 멘보샤 랑 맛있다 자주 되다 맛있다 자주 곳 맛있다 꼭 들다 맛있다 앞 족발 맛 좋다 쫄깃해 반찬 맛있다 너무 맛있다 너무 맛있다 너무 맛있다 짐하다 맛있다 더 맛있다 서다 맛있다 더 맛있다 어묵 맛있다 다 맛있다 바삭 맛있다 여기다 맛있다 하다 맛있다 자체 맛있다 고소하다 맛있다 다가 맛있다 고소하다 맛 더하다 고소하다 맛 더하다 고소하다 맛있다 꼭 씹다 고소하다 먹다 고소하다 볶음밥 고소하다 부드럽다 쫄깃 하다 부드럽다 족발 처음 먹다 부드럽다 탱글탱글하다 부드럽다 많다 촉촉하다,1
맛있다 것 같다 맛있다 보이다 육즙 맛있다 자다 먹다 맛있다 먹다 맛있다 맛있다 중 하나 맛있다 느껴지다 테이블 맛있다 것 같다 맛있다 원래 시흥 맛있다 먹다 수 맛있다 밥 반찬 맛 있다 하다 맛 너무 좋다 맛 좋다 편하다 여서 맛있다 촉촉하다 맛있다 먹다 맛있다 먹다 맛있다 목살 맛있다 더 맛있다 득살 맛있다 너무 맛있다 더 맛있다 너무 맛있다 너무 맛있다 고소하다 짭짤하다 맛 고소하다 맛 너무 특유 고소하다 먹다 고소하다 부드럽다 촉촉하다 맛있다 부드럽다 그렇다 자다 부드럽다 쫄깃 하다 고기 부드럽다 워낙 부드럽다 워낙 부드럽다 촉촉하다 맛있다 자다 부드럽다 촉촉하다,1
맛있다 자르다 먹다 맛있다 카운터 로 맛있다 자다 먹다 굽다 맛있다 너무 맛있다 촉촉하다 맛있다 집 맛있다,1
맛있다 해드리다 가보다 맛있다 대서 보기 맛있다 말씀 신의 맛 나다 껍 김치 맛있다 집 맛있다 오다 맛있다 부드럽다 육즙 입 목살 부드럽다,1
맛집 있다 웨이팅 쫀득 맛있다,1
맛있다 밑반찬 맛있다 맛있다 고기 삼각형 맛있다 씨앗 젓갈 맛있다 득살 맛있다 맛보다 양념 맛있다 맛있다 꼭 이렇게 맛있다 먹다 인데 맛있다 다양하다 나오다 맛 있다 먹다 정말 맛있다 밑반찬 맛있다 반짝거리다 맛있다 고소하다 맛있다 먹다 맛있다 득살 맛있다 너무 맛있다 양념 맛있다 더 맛있다 시원하다 맛있다 여기 맛있다 상당하다 맛있다 고소하다 굽다 쫀득살 고소하다 맛있다 씨앗 고소하다 맛 더하다 굽다 고소하다 가득하다 고소하다 먹다 고소하다 부드럽다 쫄깃해 서다 맛있다 부드럽다,1
맛있다 배곧 고기 맛있다 씨앗 젓갈 맛있다 거 같다 진짜 맛있다 안집 맛있다 하다 맛있다 진짜 맛있다 너무 맛있다 고소하다 맛있다 진짜 맛있다 진짜 맛있다 너무 맛있다 추다 맛있다 고소하다 너무 맛있다 넘다 고소하다 진짜 고소하다 부드럽다 요 고기,1
맛있다 요 목살 맛있다 어서 흐름 맛있다 특제 소스 맛 너무 좋다 로 맛있다 집 맛있다 더 맛있다 너무 맛있다 너무 맛있다 고소하다 맛있다 고소하다 쫄깃 하다 고소하다 맛있다 특제 높다 고소하다 찍다 고소하다,1
맛있다 육즙 목살 맛있다 같이 비비다 맛있다 무한 계속 맛있다 롱 평소 맛있다 너무 자다 맛있다 자주 찾아가다 맛있다 규 정말 맛있다 또 다 맛있다 규 어묵 맛있다 규 메뉴 맛있다 아주 쏙 맛 느끼다 좋다 맛 좋아하다 콩가루 맛 더 맛있다 맛 좋다 편이 시원하다 맛있다 더 맛있다 먹다 맛있다 워낙 맛있다 더 맛있다 더 맛있다 메뉴 맛있다 너무 맛있다 파이 맛있다 다 맛있다 정말 맛있다 밥 맛있다 김치 맛있다 것 맛있다 고소하다 느껴지다 쫄깃 고소하다 껍데기 먹다 고소하다 맛 좋아하다 의 고소하다 먹다 고소하다 평소 고소하다 부드럽다 쫄깃핫 다가 워낙 부드럽다,1
