context,key
맛보다 수 있다 맛 좋다 요 정말 맛있다 고소하다 맛 특징 라떼 고소하다 부드럽다 맛 좋다 굉장하다 부드럽다 촉촉하다 바나나 플람베 굉장하다 촉촉하다,1
맛있다 하다 라떼 맛있다 들다 니다 케이크 맛있다 라떼 맛있다 고소하다 고르다 좋다 산미 고소하다,1
맛있다 픽 버터 다 맛있다 고소하다 맛 당근 고소하다 배곧 스콘 듯 고소하다 텁텁 고소하다,1
맛있다 커피 디저트 들다 맛있다 고소하다 특징 이다 라떼 고소하다,1
맛있다 티라미슈 좋아하다 맛있다 디저트 카페 촉촉하다 맛있다 후 맛있다 촉촉하다 맛있다 티라미슈 다 촉촉하다,1
맛있다 스콘 따뜻하다 맛있다 다 꾹 맛있다 예쁘다 특히 맛있다 널리 널리 맛있다 카페 예쁘다 다 맛있다 너무 맛있다 로 맛있다 디저트 맛있다 고소하다 쓴맛 강하다 신선하다 내부 깔끔하다 느낌 신선하다,1
맛있다 분위기 좋다 잼 맛있다 고소하다 맛있다 고소하다 겉 안다 고소하다 맛있다 분위기 스콘 고소하다 커피 고소하다 부드럽다 느낌 자스민 고르다 부드럽다 촉촉하다 느낌 아메리카 안다 촉촉하다,1
맛있다 초코 시트 적당하다 맛있다,1
맛있다 마카롱 겉 맛 좋다 라 더 맛있다 고소하다 산미 딱 커피 고소하다 부드럽다 적당하다 하다 너무 부드럽다 촉촉하다 너무 부드럽다 시트 촉촉하다,1
맛있다 크기 이렇게 맛있다 넘다 기대다 맛있다 카페 또 맛 좋아하다 스타일 맛 좋다 메이플 맛 너무 좋다 엄청 맛있다 더 맛있다 스콘 맛있다 고소하다 맛 느끼다 고소하다 맛 좋아하다 고소하다 하다 바닐라 고소하다 요 이렇게 고소하다 빵 맛 고소하다 음료 따뜻하다 라떼 고소하다 싫어하다 고소하다 부드럽다 고소하다 하다 고소하다 진하다 고소하다 바삭 고소하다 궁금하다 고소하다 부드럽다 어디 만으로 부드럽다 고소하다 하다 아주 부드럽다 엄마 부드럽다 고소하다 부드럽다,1
부드럽다 자스민 선택 부드럽다 아이스 아메리카노 가볍다 부드럽다,1
맛있다 많다 요양 맛있다 염 마카롱 맛있다 추천 해 스무디 맛있다 긋다 맛있다 디저트 맛있다 부드럽다 바나나 향 플람베 부드럽다,1
맛있다 초코 헤 맛있다 거 씐남 맛있다 거 먹다 같이 맛있다 하다 맛있다 좋다 맛있다 에서 맛있다 고소하다 분위기 넘다 라떼 고소하다,1
맛 좋아하다 원두 고소하다 맛있다 고소하다 솔솔 나다 고소하다 또 잇다 굽다 고소하다 포근포근하다 고소하다 부드럽다 고소하다 부드럽다 고소하다 또 속 부드럽다,1
맛있다 라 모임 맛있다 커피 오다 맛있다 카페 찾다 느낌 맛있다 고소하다 맛있다 디저트 맛있다 요 맛있다 디저트 맛있다 고소하다 쫀득 하다 넘다 고소하다,1
신선하다 마카롱 사실 딸 신선하다,1
맛있다 저 먹다 빵 맛있다,1
맛있다 먹다 요 너무 맛있다,1
맛있다 노을 너무 너무 맛있다,1
맛 안 아주 느끼다 카페 이다 느끼다 해주다 요 느끼다 저 고금 느끼다 해주다 배곧 느끼다 싶다 분,0
맛있다 숩니 다 진짜 맛있다,1
프라페 맛있다 고소하다 초코 자 아메리카노 고소하다,1
하다 맛있다 이드 맛있다 촉촉하다 쫄깃 하다,1
음료 맛있다,1
촉촉 보다는 포슬포슬,1
부드럽다 순하다 맛,1
맛집 없어지다 않다 않다 고소하다 짜다리의 스콘 의 원 짜다리의 짜다리의 스콘 의 원 짜다리의 딱딱하다 하다 곳,0
곳 맛있다 더 맛있다,1
느끼다 예쁘다 한데,0
맛있다 태 쨩 하다 맛있다,1
맛있다 또 잇다 맛있다 요 민트 맛있다 요화 하다 맛있다 커피 오다 맛있다 곳 나중 맛 특히 좋다 커피 맛있다 다 맛있다 더 맛있다 욬 맛있다 케이크 맛있다,1
보단 부드럽다,1
맛있다 이야기 유자 맛있다 빵 우 맛있다 요 저 맛 진하다 맛있다 진하다 맛있다 빵 맛있다 조르다 맛있다 무엇 맛있다 사진 맛있다 순 맛있다 부드럽다 겉 뭐 뭐 부드럽다 싱싱하다 진하다 좋다 맛 싱싱하다,1
맛있다 아메리카노 굉장하다 맛있다 하다 신형 맛있다 듯 시원하다 맛있다 다이어트 깜빡 맛있다 심지어 예쁘다 맛 좋다 라떼 라떼 맛있다 굉장하다 맛있다 더욱 맛있다 어찌나 맛있다 이드 맛있다 고소하다 맛 좋다 굉장하다 고소하다 부드럽다 먹다 싶다 주신 부드럽다,1
맛있다 개다 변경 맛있다 맛있다 엇 맛있다 배곧 카츠 웰던 맛있다 카레밥 맛있다 카레밥 맛있다 카레 맛있다 맛 맛있다 다 맛있다,1
맛보다 있다 증명 맛있다 돈까스 볼 카레밥 맛있다 청 맛있다 부드럽다 짱짱 감동 부드럽다 식감 안심 부드럽다 안심 짱짱 부드럽다 이나 알리다 아프다 부드럽다 취향 부드럽다 충분하다 부드럽다 짱짱 부드럽다,1
맛있다 것 요 특출나다 맛있다 부드럽다 씹히다 트러플 굉장하다 부드럽다,1
맛있다 그렇다 스타일 있다 맛있다 촉촉하다 걸 조금 다 촉촉하다,1
간 안 되다,0
맛있다 사진 찍다 더하다 맛있다 때 맛있다 보다 맛있다 부드럽다 씹히다 맛 촉촉하다 하다 느끼다 약간 촉촉하다 정갈하다 요 돈카츠 정말 정갈하다,1
부드럽다 좋다 먹다 느낌 부드럽다 촉촉 부드럽다 촉촉 부드럽다 좋다,1
간 맞추다 미리 살짝 맛있다 촉촉하다 맛있다 밉다 맛있다 부드럽다 촉촉하다 맛있다 안심 부드럽다 촉촉하다 기름기 비계 부드럽다 촉촉하다 드리다 촉촉하다,1
너무 부드럽다,1
순 맛있다 다 맛있다 것 부드럽다,1
부드럽다 붉다 은색 안심 부드럽다,1
맛있다 명 콤 맛있다 프리미엄 등심 향 맛있다 좋다 맛있다 부드럽다 훨씬 미디움 부드럽다 자다 씹히다 미디움 부드럽다 걸리다 부드럽다,1
맛 나다 결론 부드럽다 향 좋다 로 부드럽다 밥 부드럽다 촉촉 기르다 와사비,1
맛있다 카레 괜찮다 정말 맛있다 부드럽다 비계 싫어하다 로 부드럽다,1
맛있다 주문 웰던 맛있다 느낌 받다 하다 맛있다 고기 맛있다 신선하다 하다 맛있다 그만큼 신선하다 촉촉임 사장 친절하다 하다 촉촉하다 안심 촉촉임,1
명의 맛있다 부드럽다 고기 로,1
카레밥 맛있다 로 맛있다 엄청 부드럽다,1
맛있다 특히 카레라이스 맛있다 남다 다 맛있다 보다 김치 맛있다 곳 적 맛 나다 쿄 너무 맛있다 부드럽다 맛있다 돈까스 맛있다 돈까스 맛있다 부드럽다 하나 지다 부드럽다 맛있다 남다 굉장하다 부드럽다 너무 부드럽다,1
맛있다 돈까스 바꾸다 보다는 맛있다,1
맛있다 웰던 미디엄 맛 있었슴 먼저 부드럽다 맛있다 먹다 맛있다 부드럽다 맛있다 웰던 부드럽다 육즙 에서 부드럽다 정말 맛 안심 부드럽다 굉장하다 부드럽다 가장 부드럽다,1
간 맞추다 줄이다 부드럽다 같다 정도 돈까스 부드럽다 신선하다 취향 돈까스 비주 신선하다,1
맛있다 사실 안심 맛있다 등심 저 맛 너무 좋아하다 맛 육즙 좋아하다 너무 맛있다 안심 맛있다,1
느끼다 수 있다,0
맛있다 저 맛있다 많다 맛있다 저 맛있다,1
맛있다 현이 랑 진짜 맛있다 중 맛있다,1
맛있다 톤 쇼 짱 맛있다 친절하다 맛있다,1
부드럽다 맛있다 먹다 맛있다 에서 부드럽다 촉촉하다 하나 진짜 진짜 촉촉하다,1
맛있다 난리 카레 은근 맛있다 카레 맛있다,1
맛집 유명하다 있다 맛있다 돈까스 기다리다 맛집 맛있다 먹다 맛있다 사진 얼른 맛있다 먹다 방법 먹다 맛있다 다 맛있다 까지 맛있다 가장 맛있다 방법 맛있다 고소하다 참깨 드레싱 주심 고소하다 부드럽다 등심 맛 부드럽다 하다 입 안심 부드럽다 안심 부드럽다,1
맛있다 분점 배곧 맛있다 먹다 방법 맛있다 물어보다 저 맛있다 매장 에서 맛 하다 맛있다 맛 나다 하다 에서 맛있다 유명하다 맛있다 소스 맛있다 께서 맛있다 더 맛있다 하다 맛있다 나 맛있다 촉촉하다 느낌 보이다 바삭바삭 촉촉하다,1
간 맞추다 갈다 맛있다 나물 이랑 맛있다 만족하다 이다 님 맛있다 먹다 맛있다 너무 맛있다,1
맛있다 사장 님 맛집 있다 생각나다 다 맛있다 소금 맛있다 정말 맛있다 부드럽다 돼지고기 의 깃쫄깃 부드럽다 신선 보이다 적다,1
맛있다 역쉬 매진 떡뻥 맛있다,1
맛있다 맛있다 맛있다 맛있다 맛 에서 맛있다 직원 분 맛있다 자다 먹다 맛 정말 최고 고기 맛있다 까지 맛있다 맛있다 맛있다 까지 맛있다 초밥 맛있다 오늘 맛있다 에는 맛있다 너무 맛있다,1
부드럽다 맛있다 부드럽다 하다 소금 부드럽다 맛있다 등 보다 부드럽다 훨씬 부드럽다 오 부드럽다,1
맛있다 교육 받다 맛있다 오일 파스타 맛 있다 음 맛 좋다 말 만들다 맛있다 꾸다 맛있다,1
하다 맛있다 카레밥 맛있다 부드럽다 하다 맛있다 훨씬 부드럽다,1
간 맞추다 부터 맛있다 곳 곳 맛있다 먹다 하다 맛있다 하다 크루아상 근래 맛있다 부터 맛있다 빵 맛있다 다 맛있다,1
맛있다 요리 먹다 느끼다 아니다 맛있다,1
간이 있다 않다 맛 않다 참고,0
느끼다 맛 잊다 느끼다 수 오다,0
맛있다 하다 논 맛있다 또 주다 맛있다 놀래다 벌이다 맛있다 다 시 맛있다 하다 거 맛있다 등심 보다 진짜 맛있다 더 맛있다 먹다 맛있다 카레 맛있다 진짜 맛있다 더 맛있다 등심 맛있다 더 맛있다 부드럽다 깊다 밉다 오다 부드럽다,1
맛있다 하다 메뉴 너무 맛있다 보다 촉촉하다,1
보다 맛있다 고소 걸 좋아하다 부드럽다 비계 살코기 촉 부드럽다 촉촉하다 육질 원하다 촉촉하다 깊다 맛 미디움 촉촉하다 어우러지다 촉촉하다,1
맛있다 요 트러플 충분하다 맛있다 충분하다 맛있다,1
맛있다 맛있다 방법 맛있다 하다 꾸꾸 아주 맛있다 먹다 맛있다 신기하다 맛있다 부드럽다 원하다 안심 좀 부드럽다,1
맛있다 가스 등 맛있다 돈가스 후기 맛있다 과 하다 맛있다 해치다 몇 맛있다 먹다 수 살펴보다 맛있다 소스 맛있다 더욱 맛있다 돈가스 맛있다 더 맛있다 부드럽다 안심 부터 부드럽다 들어가다 녹다 미디움 부드럽다 하다 부드럽다 싱싱하다 명 이나 샐러드 싱싱하다 정갈하다 메뉴 샐러드 가능하다 정갈하다,1
맛있다 트러플 소금 맛있다 트러플 소금 더 맛있다 더 맛있다 더 맛있다 먹다 맛있다 부드럽다 취향 고르다 부드럽다 좋아하다 안심 더 부드럽다,1
맛있다 재촉 하다 빨리 맛있다 부드럽다 제 스타일 많다 부드럽다,1
맛있다 소금 보다는 맛있다 명 이나 맛있다 힘들다 있다 보다는 맛있다 올리다 맛있다 올리다 맛있다 부드럽다 들다 있다 고기 부드럽다,1
맛있다 등심 보다는 맛 있다 느끼다 보다 맛있다 수 맛있다 다 맛있다 너무 맛있다 충분하다 맛있다 부드럽다 맛 이다 훨씬 부드럽다,1
짜다 스벅 라니 짜다 스벅 라니,0
맛있다 저희 앉다 찍다 맛있다 고기 맛있다 부드럽다 맛있다 그냥 맛있다 다 부드럽다 촉촉하다 보이다 맛 왈 촉촉하다 세상 촉촉하다 샐러드 싱싱하다,1
맛있다 읍니 다 맛있다 시럽 맛 맛 나다 룰루 무난 맛있다 스무디 맛있다 부드럽다 나다 하다 훨씬 부드럽다,1
맛있다 주문 번호 맛있다 사이다 시키다 맛있다 블로그 글 맛 나다 기 부드럽다 맛있다 다 맛있다 보다 맛있다 그냥 맛있다 좋다 맛있다 고기 부드럽다,1
부드럽다 돈 카츠 매콤 부드럽다,1
맛 별로 좋아하다,0
맛 나다 돌판 맛 맛 나다,1
맛있다 약간 좀 바로 맛있다 훨씬 맛있다 부드럽다 돈까스 보다는 요 부드럽다,1
기르다 고소하다 부드럽다 기르다 고소하다 있다 부드럽다,1
간 길다 않다 아니다 맛집 느끼다 되다 의,0
맛있다 샐러드 하다 맛있다 카레 그릇 맛있다 트러플 소금 먹다 맛있다 정말 맛있다 로 맛있다 어떻다 맛있다 부드럽다 육즙 제대로 부드럽다 겉바 촉 다 부드럽다 다 부드럽다 싱싱하다 로 넣다 샐러드 싱싱하다,1
진하다 맛있다 굳다 맛있다 촉촉 육즙 폭발,1
맛있다 가다 그 수 맛있다 너무 맛있다,1
맛있다 불가 먹다 맛있다 계속 먹다 너무 맛있다 너무 맛있다 고소하다 맛있다 정말 맛있다 진짜 맛있다 진짜 맛있다 정말 맛있다 느낌 맛있다 고소하다 폭발 다 너무 고소하다 진짜 고소하다 부드럽다 많이 계속 정말 부드럽다,1
맛있다 카츠 오 맛있다 보다 살짝 먹다 맛있다 부드럽다 부위 인 부드럽다 인상 의 부드럽다 유자 소스 편안하다 부드럽다,1
맛있다 돈가스 다 맛있다 연신 빨리 맛있다 여기 너무 맛있다 그냥 죽 맛집 늘어나다 있다 맛집 있다 망하다 진짜 맛있다 돈가스 맛있다 넘다 맛있다 바로 맛있다 진짜 맛있다 판교 맛있다 너무 맛있다 등심 맛있다,1
부드럽다 식감 하다 안심 부드럽다 촉촉하다 맺다 잇다 육즙 촉촉하다,1
간 맞추다 웨이 맛있다 꼭 프리미엄 먹다 맛있다,1
맛있다 냄새 차다 맛있다 등 갈비 맛있다 거 알 맛있다 거 느낌 너무 맛있다 너무 맛있다 더 맛있다 더 맛있다 고소하다 자다 부치다 얇다 고소하다,1
맛있다 것 같다 맛있다 시흥 배곧 맛있다 다 남다 맛 좋다 하다 너무 맛있다 다 맛있다 다르다 맛있다 찍다 맛있다 고소하다 향 긋다 고소하다 하다 장 부터 고소하다 진짜 고소하다,1
간단하다 간결하다 딱 맛보다 수 있다 맛 수 있다 맛 나다 먹다 맛 좋다 고기 고소하다 하다 가지 아주 고소하다 싱싱하다 잡다 전혀 맛 싱싱하다,1
맛있다 맵다 것 맛 하다 있다 맛 나다 그리고 맛 좋다 하다 어우러지다 맛있다 고소하다 메밀 의 고소하다 알밤 당기다 먹다 고소하다 요 고소하다 부드럽다 이랑 같이 야들야들하다 부드럽다,1
맛 나다 설탕 맛 쓰이다 있다 무난 맛있다,1
맛있다 곤드레 밥 맛 있다 기본 투하 맛있다 먹다 맛있다,1
맛있다 부드럽다 뼈 맛있다 추가 당면 시원하다 맛있다 갈비 맛있다 먹다 맛있다 먹다 맛있다 부드럽다 뼈 자다 맛있다 부드럽다 촉촉하다 자다 베다 하다 촉촉하다,1
맛있다 것 같다 맛있다 메밀전 처음 맛있다 것 같다 맛있다 매콤 하다 맛있다 것 같다 맛있다 말 계속 맛있다 등 갈비 더 맛있다 고소하다 맛있다 더 맛있다 정말 맛있다 더욱 맛있다 친구 맛있다 로 맛있다 넣다 맛있다 저렴하다 맛있다 진짜 고소하다 얼마나 부드럽다 너무 부드럽다,1
맛있다 다자 글자 맛있다 다 먹다 맛있다 하마 오다 콩나물 맛있다 국물 맛있다 메밀 맛있다 가다 맛있다,1
고소하다 메밀 향 그냥 고소하다,1
맛있다 메일 정말 맛있다 등 갈비찜 더 맛있다 조금씩 맛있다 고소하다 다 추가 고소하다 것 같다 고소하다 상황 이다 정말 고소하다 하다 고소하다 진하다 고소하다,1
맛 나다 계속 메밀 맛있다 갈비 부드럽다,1
맛있다 각 버섯 맛 시키다 좋다 비비다 맛있다,1
메밀 맛있다 맵 맛있다,1
맛있다 등 갈비 맛있다 메밀전 의 맛 딱 좋다 먹다 맛있다 거 맛있다,1
맛있다 곤 드레 맛있다 자다 먹다 맛 나다 거부 맛 생각나다 사장 너무 맛있다 먹다 맛있다 너무 맛있다 너무 맛있다,1
맛있다 등 갈비 맛있다 콩나물 과 가다 맛있다 익다 맛있다 요 맛있다 부드럽다 발리 중독 엄청 부드럽다,1
맛있다 아 너무 맛 좋아하다 강력 고소하다 메밀 버섯 고소하다 취향 보이다 고소하다 등 갈다 기다리다 고소하다 너무 고소하다 드레밥 고소하다 부드럽다 뼈 분해 적당하다 부드럽다,1
맛있다 맛 내기 맛있다 먹어주다 곤드레 맛있다 먹다 수 맛있다 걸 매장 맛 너무 좋다 로 맛있다 다 맛있다 정말 맛있다,1
고소하다 맛 이에요 식감 고소하다,1
부드럽다 육질 등 쏠쏠하다 부드럽다 정갈하다 세팅 되어다 밑반찬 정갈하다,1
맛있다 나가다 때 진짜 맛있다 너무 맛있다 고소 고소 등,1
맛있다 먹다 물어보다 쫄깃 맛있다 메밀전 맛있다 하다 맛있다 부드럽다 뼈 자다 고기 부드럽다,1
피자스쿨 맛있다 고소하다 곤 드레 또 고소하다,1
맛있다 먹다 있다 맛있다 끓다 오르다 맛있다 버섯 콩나물 더 맛있다 보글보글 맛있다 부드럽다 맛있다 먹다 맛있다 먹다 맛있다 요 맛있다 부드럽다 슥 넘어가다 부드럽다 자다 떨어지다 부드럽다 빠지다 두툼 부드럽다 달달 해 메밀전 부드럽다 좋다 부드럽다 내다 부드럽다 버섯 부드럽다,1
맛있다 직성 풀리다 맛있다 천 안 맛있다 보다 다 맛있다 넣다 하다 맛있다 저 주문 맛있다 꼭 데리 맛 있다 더하다 맛 좋다 맵다 맛 있다 싶다 방문 맛있다 쫄깃쫄깃 맛있다 먹다 맛있다 있다 맛있다 곁들이다 맛있다 먹다 맛있다 더욱 맛있다 알밤 맛있다 고소하다 담백하다 등 고소하다 중간 중간 추가 고소하다 의 고소하다 부드럽다 양념 골고루 버섯 부드럽다 신선하다 것 같다 더욱 신선하다,1
맛있다 찾다 곳 맛있다 맛보다 곳 맛있다 곤드레 이랑 맛있다 먹다 수 맛있다 떡 사리 맛있다 즐기다 수 맛보다 수 있다 맛있다 먹다 수 맛있다 먹다 수 맛있다 거 있다 맛있다 먹다 수 맛있다 먹다 동생 맛 좋다 요 신세계 맛있다 맛있다 맛보다 먹다 맛있다 사리 맛있다 더 맛있다 서다 맛있다 더 맛있다 더 맛있다 진짜 맛있다 정말 맛있다 너무 맛있다 든든하다 맛있다 요 맛있다 고소하다 나물 밥 부드럽다 쫀득하 게 정말 부드럽다,1
고소하다 밥 꼬돌해 드레나물밥 고소하다,1
맛집 있다 내부 맛있다 나 하다 맛 있다 너무 찍다 맛있다 부드럽다 돈 스파이크 해 부드럽다,1
맛있다 절로 이다 맛있다 버섯 인 맛있다 고소하다 간 맛있다 푹 끓이다 반신반의 맛있다 너무 맛있다 여서 맛있다 먹다 맛있다 너무 맛있다 고소하다 메밀전 즐기다 고소하다 간 더 쫄깃 고소하다 맛있다 고소하다 촉촉하다 식감 양념 싱싱하다 전혀 숨다 콩나물 싱싱하다,1
간이 딱 좋다 맛있다 등 갈비 맛있다 등 갈비 맛있다 추가 주문 맛있다 맵다 향기 맛있다 재료 정말 맛있다 수 뻘건 맛있다 맵다 맛 맛 있다 저 맛 달짝지근하다 맛있다 맛 그만큼 맛있다 해주다 맛있다 집 맛있다 고소하다 맛있다 산뜻하다 맛있다 달짝지근하다 맛있다 짭짤하다 맛있다 그만큼 맛있다 너무 맛있다 다 맛있다 색깔 맛있다 어쨌든 맛있다 고소하다 맛있다 등 고소하다 맛 나 하다 고소하다 먹다 고소하다 부드럽다 많이 붙다 부드럽다 치아 약하다 너무 부드럽다 정말 부드럽다,1
맛 하다 있다 맛 좋다 받다 맛 좋다 든든하다 먹다 맛있다 고소하다 맛 일품 신선하다 것 처럼 아주 신선하다,1
맛있다 등 갈비 먹다 맛있다 고소하다 향 솔솔 담백하다 고소하다,1
맛집 이라서 있다 부드럽다 육질 입안 부드럽다 뼈 랑 부드럽다 씹다 뜯다 그렇다 부드럽다 육질 부드럽다 촉촉하다 적다 제대로,1
맛있다 하다 들다 맛있다 즐기다 수 기 맛있다 다 맛있다 고소하다 맛있다 고소하다 매콤 하다 있다 고소하다 로 고소하다 더욱 고소하다 부드럽다 육질 느껴지다 부드럽다 숨 죽 부드럽다 식감 느끼다 부드럽다 감다 좋다 고기 부드럽다 라 부드럽다 정갈하다 차림 보이다,1
맛집 기분 좋다 맛 좋다 양념 있다 맛보다 부드럽다 사이사이 매콤 부드럽다 녹아내리다 육질 부드럽다 쫄깃 하다 넣다 부드럽다 들다 부드럽다,1
맛 나다 싹싹,1
맛있다 동치미 맛 맛있다 버섯 좀 맛있다 매다 달다 맛 나다 짱아찌 짱아찌 맛있다 부드럽다 맛있다 에서 맛있다 부드럽다 다 하나 부드럽다 시키다 잡다 정말 부드럽다 고기 부드럽다,1
맛 없다 곳 맛 변하다 않다 맛 입안 얼얼하다 느끼다 수 있다,0
맛 있다 염려 맛 아주 좋다 맛 단맛 있다 고소하다 메밀전 이다 준비 고소하다,1
맛있다 음식 찾아보다 맛있다 수 있다 맛있다 자다 먹다 맛있다 까지 너무 맛있다 끓이다 기 맛집 에서는 있다 맛있다 끓이다 콩나물 맛있다 아 삭함 맛있다 집 입 맛있다 먹다 수 맛있다 음식 과 맛있다 먹다 물어보다 돌려주다 맛있다 것 맛있다 친구 맛있다 고소하다 맛있다 자작하다 맛있다 너무 맛있다 에서 맛있다 훨씬 맛있다 친절하다 맛있다 고소하다 맛있다 까지 고소하다 더하다 음식 물의 고소하다 부드럽다 뼈 오다 야들야들 부드럽다,1
맛있다 들다 양푼 맛있다 알차다 먹다 드리다 맛있다 가족 맛있다 진짜 맛있다 모로 맛있다,1
맛있다 솔솔 올라오다 맛 내다 있다 조리 맛있다 고소하다 곤 레나 것 고소하다,1
맛있다 것 같다 맛있다 맵다 맛 맛있다 등 갈비 맛있다 먹다 수 맛있다 등 갈비 맛있다 인 것 맛있다 매콤 좋다 맛있다 다 먹다 맛있다 등 갈비 맛 있다 대비 더 맛있다 아주 맛있다 분 맛있다 원 맛있다 정갈하다 맛있다 좋다 맛집 더 맛있다 너무 맛있다 저 맛있다 고소하다 맛 있다 부드럽다 뼈 하다 엄청 부드럽다 정갈하다 맛있다 인 너무 정갈하다,1
맛있다 먹다 모습 맛있다 우리 부부 더라고요 맛있다 훨 맛있다 부드럽다 뼈 쓱쓱 요 부드럽다,1
나오다 고소하다,1
맛있다 맵다 맛 맛있다 자다 먹다 적당하다 맛있다 너무 맛있다 이랑 맛있다,1
간이 딱 맞다 맛집 있다 기대 맛있다 국물 좀 하다 맛있다 훨씬 맛있다 더 맛있다 부드럽다 쫀득해 서다 더 부드럽다,1
맛있다 별미 메밀 맛있다 먹다 수 맛있다 음식 이라는 맛있다 식사 하다 맛있다 야식 이나 맛있다 즐기다 정말 맛 있다 하다 너무 맛있다 더 맛있다 정말 맛있다 너무 맛있다 천천히 맛있다 고소하다 메밀전 나 하니 고소하다,1
맛있다 남기다 알다 맛있다 것 같다 맛있다 정왕동 밥집 맛 나다 당면 계정 맛있다 먹다 맛있다 먹다 맛있다 든든하다 맛있다 고소하다 것 같다 고소하다 괜찮다 등 고소하다 마냥 고소하다 더 고소하다 밥 고소하다 담백하다 고소하다 마냥 고소하다 재의 신선도 노랗다 싱싱하다,1
맛있다 메밀 끓이다 색다르다 맛있다,1
맛보다 수 있다 맛보다 수 있다 맛보다 수 있다 부드럽다 입 에서 부드럽다 뼈 랑 육질 부드럽다 갈비 부드럽다 정갈하다 같이 즐기다 등 정갈하다,1
맛있다 스파이크 하다 맛있다 빨리 맛보다 맛있다 음식 서비스 맛있다 매콤 갈비 맛있다 요 아주 맛있다 연신 하다 갈비 맛있다 너무 맛있다 익숙하다 맛있다 너무 맛있다 너무 맛있다 어찌나 맛있다 넘다 맛있다 고소하다 나다 요 고소하다 오묘하다 맛 엄청 고소하다 하다 고소하다 부드럽다 젓가락 떼다 어찌나 부드럽다,1
맛있다 의 오다 맛있다 것 알 맛있다 메밀 전과 맛보다 수 있다 맛있다 버섯 어느 맛있다 그렇다 너무 맛있다 곳 정용진 맛있다 있다 생각 맛있다 소스 정말 맛있다 음식 먹다 정말 맛있다 고깃집 맛있다 메뉴판 맛있다 너무 맛있다 보다 맛있다 너무 맛있다 진짜 맛있다 얼마나 맛있다 향 맛있다 너무 맛있다 둘이서 맛있다 고소하다 쫄깃 하다 고소하다 나물 냄새 고소하다 향 맛있다 에는 고소하다 밥 고소하다 의 고소하다 얼마나 부드럽다,1
맛있다 리스트 나오다 맛있다 음식 집 맛있다 레알 술안주 맛있다 건 안 맛있다 그냥 먹다 맛있다 먹다 등 맛있다 거 먹다 맛있다 거 많이 뽑다 맛있다 스파이크 맛있다 먹다 맛있다 먹다 맛있다 먹다 맛있다 너무 맛있다 너무 맛있다 다 맛있다 다 맛있다 고소하다 쫄깃 하다 고소하다 담백하다 나물 고소 매콤 짜다 더 고소하다 반복 고소하다,1
